{
  "titles": [
    { "text": "How Vesuvius Buried an Empire's Ambitions", "approach": "curiosity" },
    { "text": "The Eruption That Froze Pompeii in Time", "approach": "direct" },
    { "text": "What 18 Hours of Ash Did to Pompeii", "approach": "specificity" },
    { "text": "Why Pompeii's Victims Never Had a Chance", "approach": "outcome" },
    { "text": "Inside Pompeii: A City Sealed by Disaster", "approach": "explanatory" }
  ],
  "description_summary": "In 79 CE, Mount Vesuvius buried the city of Pompeii under volcanic ash, preserving it for nearly two thousand years.",
  "value_proposition": "This video walks through what the eruption actually did, hour by hour, and what it left behind.",
  "context": "",
  "cta_text": "Subscribe for more stories from the ancient world.",
  "intro_chapter_label": "Introduction",
  "chapter_labels": [
    { "section_id": "body-1", "label": "The Eruption" }
  ],
  "tags": ["pompeii", "mount vesuvius", "ancient rome", "roman history", "volcanic eruption"],
  "hashtags": ["#pompeii", "#history", "#ancientrome"],
  "pinned_comment": "What surprised you most about the timeline of the eruption? Let me know below.",
  "community_post": "New video: how a single eruption buried an entire Roman city. Link in the next post!",
  "promotional_copy": "One eruption. One city. Nearly two thousand years frozen in time. New video is up now."
}
